{
  "version": 1,
  "generatedAt": "2026-03-29T17:47:02Z",
  "purpose": "Public-safe status view for the GDPR full-mapping programme and the current ISO AI standards mapping wave inside OpenCompliance. It records what is already mapped, what remains candidate-only, and where the remaining work is widening, not inventing, the public-control layer.",
  "programs": [
    {
      "programId": "gdpr_full_mapping",
      "title": "GDPR full-mapping program",
      "sourceAvailability": "public_exact_feasible",
      "openComplianceState": "public_exact_anchor_review_available",
      "summary": {
        "mappedPublicControls": 28,
        "implementedPublicControls": 28,
        "plannedPublicControls": 0,
        "leanBackedPublicControls": 13,
        "familyRolloutEntries": 12,
        "reviewedExactAnchorEntries": 32,
        "candidateExactAnchorEntries": 1,
        "blockedExactAnchorEntries": 0,
        "nextDepthControlCount": 8
      },
      "familyRollout": [
        {
          "family": "automated_decision_and_rights_boundary",
          "mappedControls": 1,
          "implementedControls": 1,
          "plannedControls": 0,
          "leanBackedControls": 0,
          "routeCounts": {
            "decidable": 0,
            "attestation": 0,
            "judgment": 1,
            "mixed": 0
          },
          "controlIds": [
            "oc.ai-10"
          ]
        },
        {
          "family": "automated_decision_human_review",
          "mappedControls": 2,
          "implementedControls": 2,
          "plannedControls": 0,
          "leanBackedControls": 1,
          "routeCounts": {
            "decidable": 1,
            "attestation": 1,
            "judgment": 0,
            "mixed": 0
          },
          "controlIds": [
            "oc.ai-09",
            "oc.ai-12"
          ]
        },
        {
          "family": "data_locality_and_transfer_boundary",
          "mappedControls": 1,
          "implementedControls": 1,
          "plannedControls": 0,
          "leanBackedControls": 1,
          "routeCounts": {
            "decidable": 1,
            "attestation": 0,
            "judgment": 0,
            "mixed": 0
          },
          "controlIds": [
            "oc.loc-01"
          ]
        },
        {
          "family": "data_subject_rights",
          "mappedControls": 1,
          "implementedControls": 1,
          "plannedControls": 0,
          "leanBackedControls": 0,
          "routeCounts": {
            "decidable": 0,
            "attestation": 1,
            "judgment": 0,
            "mixed": 0
          },
          "controlIds": [
            "oc.privacy-01"
          ]
        },
        {
          "family": "lawful_basis_and_purpose_limitation",
          "mappedControls": 1,
          "implementedControls": 1,
          "plannedControls": 0,
          "leanBackedControls": 0,
          "routeCounts": {
            "decidable": 0,
            "attestation": 1,
            "judgment": 0,
            "mixed": 0
          },
          "controlIds": [
            "oc.privacy-03"
          ]
        },
        {
          "family": "privacy_by_design_and_default",
          "mappedControls": 1,
          "implementedControls": 1,
          "plannedControls": 0,
          "leanBackedControls": 0,
          "routeCounts": {
            "decidable": 0,
            "attestation": 0,
            "judgment": 1,
            "mixed": 0
          },
          "controlIds": [
            "oc.privacy-02"
          ]
        },
        {
          "family": "privacy_impact_assessment",
          "mappedControls": 1,
          "implementedControls": 1,
          "plannedControls": 0,
          "leanBackedControls": 0,
          "routeCounts": {
            "decidable": 0,
            "attestation": 1,
            "judgment": 0,
            "mixed": 0
          },
          "controlIds": [
            "oc.privacy-05"
          ]
        },
        {
          "family": "processors_and_subprocessors",
          "mappedControls": 3,
          "implementedControls": 3,
          "plannedControls": 0,
          "leanBackedControls": 0,
          "routeCounts": {
            "decidable": 0,
            "attestation": 2,
            "judgment": 1,
            "mixed": 0
          },
          "controlIds": [
            "oc.vendor-01",
            "oc.vendor-02",
            "oc.vendor-03"
          ]
        },
        {
          "family": "processors_and_transfers",
          "mappedControls": 1,
          "implementedControls": 1,
          "plannedControls": 0,
          "leanBackedControls": 0,
          "routeCounts": {
            "decidable": 0,
            "attestation": 1,
            "judgment": 0,
            "mixed": 0
          },
          "controlIds": [
            "oc.ai-13"
          ]
        },
        {
          "family": "security_of_processing",
          "mappedControls": 11,
          "implementedControls": 11,
          "plannedControls": 0,
          "leanBackedControls": 10,
          "routeCounts": {
            "decidable": 10,
            "attestation": 1,
            "judgment": 0,
            "mixed": 0
          },
          "controlIds": [
            "oc.crypt-01",
            "oc.id-01",
            "oc.id-04",
            "oc.id-05",
            "oc.key-01",
            "oc.mon-01",
            "oc.mon-02",
            "oc.net-01",
            "oc.net-04",
            "oc.seg-01",
            "oc.web-01"
          ]
        },
        {
          "family": "storage_limitation_and_erasure",
          "mappedControls": 3,
          "implementedControls": 3,
          "plannedControls": 0,
          "leanBackedControls": 0,
          "routeCounts": {
            "decidable": 0,
            "attestation": 2,
            "judgment": 1,
            "mixed": 0
          },
          "controlIds": [
            "oc.data-04",
            "oc.data-05",
            "oc.data-06"
          ]
        },
        {
          "family": "transparency_and_notices",
          "mappedControls": 2,
          "implementedControls": 2,
          "plannedControls": 0,
          "leanBackedControls": 1,
          "routeCounts": {
            "decidable": 1,
            "attestation": 1,
            "judgment": 0,
            "mixed": 0
          },
          "controlIds": [
            "oc.privacy-04",
            "oc.privacy-06"
          ]
        }
      ],
      "workstreams": [
        {
          "id": "authoritative_public_law_decomposition",
          "title": "Article-level and obligation-level decomposition",
          "status": "public_exact_layer_available",
          "summary": "GDPR already has a public exact-anchor corridor with 32 reviewed anchor entries across the current promoted controls.",
          "remainingWork": "Widen from the current security, transfer, rights, processor, and retention corridor into broader privacy-by-design, lawful-basis, and automated-decision boundaries without losing article-level precision.",
          "blockedBy": []
        },
        {
          "id": "public_control_normalization",
          "title": "Public-control normalization",
          "status": "complete",
          "summary": "28 public controls map to GDPR, with 28 already exercised by public fixtures and 0 still planned.",
          "remainingWork": "Promote or retire the remaining planned GDPR controls so the public ontology is explicit about coverage boundaries.",
          "blockedBy": []
        },
        {
          "id": "typed_claim_coverage",
          "title": "Typed claim coverage",
          "status": "complete",
          "summary": "The current GDPR corridor is already typed, but future privacy-design and retention slices still need explicit claim contracts before promotion.",
          "remainingWork": "Define typed evidence and attestation shapes for the remaining planned GDPR controls before widening the verifier surface.",
          "blockedBy": []
        },
        {
          "id": "lean_coverage",
          "title": "Lean coverage for decidable GDPR atoms",
          "status": "complete_for_current_corridor",
          "summary": "13 Lean-backed public controls now cover the current decidable GDPR corridor.",
          "remainingWork": "Keep Lean coverage aligned as the GDPR corridor widens into additional public-law obligations and rights workflows.",
          "blockedBy": []
        },
        {
          "id": "fixture_rollout",
          "title": "Fixture and evidence rollout",
          "status": "complete",
          "summary": "12 GDPR families are visible in rollout matrices, but 28 of 28 mapped controls are currently fixture-backed.",
          "remainingWork": "Turn the remaining planned GDPR controls into replayable fixture-backed corridors instead of leaving them as silent backlog.",
          "blockedBy": []
        },
        {
          "id": "external_review",
          "title": "External privacy and public-law review",
          "status": "program_defined",
          "summary": "A sibling GDPR and AI review program now defines the public-law, rights, and AI-specialist scrutiny path for this wave.",
          "remainingWork": "Run the review program with privacy counsel, data-protection engineers, and public-interest reviewers against the widened GDPR corpus.",
          "blockedBy": []
        }
      ],
      "publicNotes": [
        "This program does not imply all GDPR obligations are mechanised; it records the current mapped corridor and the remaining widening work.",
        "Because GDPR source text is public, exact-anchor review can be article-level and obligation-level rather than blocker-only."
      ]
    },
    {
      "programId": "iso_ai_standards",
      "title": "ISO AI standards mapping program",
      "summary": {
        "frameworksInScope": 11,
        "frameworksWithCurrentMappings": 7,
        "frameworksWithoutCurrentMappings": 4,
        "uniqueMappedPublicControls": 14,